z_vkment/5th_runs_late_Apr_gpt-oss_etc/80_11_oeg_judge_human_agreement_by_criterion_gpt-oss-120b_h34.json

{
    "criterion_grouped_scores": {
        "acc_eq": {
            "instruction_following": {
                "gpt-oss-120b_h34": 0.5863043478260871
            },
            "naturalness": {
                "gpt-oss-120b_h34": 0.5253260869565217
            },
            "coherence": {
                "gpt-oss-120b_h34": 0.5326630434782609
            }
        }
    },
    "criterion_locale_grouped_scores": {
        "acc_eq": {
            "instruction_following": {
                "ar_EG": {
                    "gpt-oss-120b_h34": 0.6432971014492754
                },
                "bn_BD": {
                    "gpt-oss-120b_h34": 0.5081521739130433
                },
                "cs_CZ": {
                    "gpt-oss-120b_h34": 0.5028985507246376
                },
                "de_DE": {
                    "gpt-oss-120b_h34": 0.5268115942028986
                },
                "en_US": {
                    "gpt-oss-120b_h34": 0.733876811594203
                },
                "hi_IN": {
                    "gpt-oss-120b_h34": 0.6375
                },
                "id_ID": {
                    "gpt-oss-120b_h34": 0.5717391304347827
                },
                "ja_JP": {
                    "gpt-oss-120b_h34": 0.4791666666666667
                },
                "ru_RU": {
                    "gpt-oss-120b_h34": 0.6398550724637682
                },
                "zh_CN": {
                    "gpt-oss-120b_h34": 0.6197463768115943
                }
            },
            "naturalness": {
                "ar_EG": {
                    "gpt-oss-120b_h34": 0.4255434782608695
                },
                "bn_BD": {
                    "gpt-oss-120b_h34": 0.5244565217391304
                },
                "cs_CZ": {
                    "gpt-oss-120b_h34": 0.5434782608695652
                },
                "de_DE": {
                    "gpt-oss-120b_h34": 0.4567028985507246
                },
                "en_US": {
                    "gpt-oss-120b_h34": 0.6230072463768116
                },
                "hi_IN": {
                    "gpt-oss-120b_h34": 0.5501811594202899
                },
                "id_ID": {
                    "gpt-oss-120b_h34": 0.47427536231884065
                },
                "ja_JP": {
                    "gpt-oss-120b_h34": 0.5231884057971015
                },
                "ru_RU": {
                    "gpt-oss-120b_h34": 0.5059782608695653
                },
                "zh_CN": {
                    "gpt-oss-120b_h34": 0.6264492753623188
                }
            },
            "coherence": {
                "ar_EG": {
                    "gpt-oss-120b_h34": 0.6057971014492753
                },
                "bn_BD": {
                    "gpt-oss-120b_h34": 0.5090579710144926
                },
                "cs_CZ": {
                    "gpt-oss-120b_h34": 0.483695652173913
                },
                "de_DE": {
                    "gpt-oss-120b_h34": 0.5068840579710144
                },
                "en_US": {
                    "gpt-oss-120b_h34": 0.5364130434782609
                },
                "hi_IN": {
                    "gpt-oss-120b_h34": 0.570108695652174
                },
                "id_ID": {
                    "gpt-oss-120b_h34": 0.4750000000000001
                },
                "ja_JP": {
                    "gpt-oss-120b_h34": 0.5284420289855073
                },
                "ru_RU": {
                    "gpt-oss-120b_h34": 0.5307971014492753
                },
                "zh_CN": {
                    "gpt-oss-120b_h34": 0.5804347826086956
                }
            }
        }
    }
}

z_vkment/Protokol_z_pokusu.md

#### (80_11) openai/gpt-oss-120b_h34, Aug 2025

Lavírování s template (verze _h33, _h43, _h34). Výsledky pro češtinu (0.484, 0.536, 0.492) , při běhu 80_11ale čeština lepší (0.502, 0.543, 0.483), není jasné proč (pouze batch size snížen), pro angličtinu (0.734, 0.623, 0.536)